<?xml version="1.0" encoding="UTF-8"?>
<!DOCTYPE olympics SYSTEM "ex1.dtd">

<olympics year="2025" city="Vienna">
    <sports>
        <sport id="S1" type="team">
            <name>Baseball</name>
            <teams>
                <!-- Team element must contain country attribute -->
                <team>
                    <coach>Felix Bauer</coach>
                    <players>
                        <player id="P1">Stefan Berger</player>
                    </players>
                </team>
            </teams>
        </sport>
    </sports>
</olympics>
